{
    "HistoricalSourceCommit":  "5880e019016c5c3a0576e97a6c2a7f14bf54e3d1",
    "HistoricalProfileCount":  695,
    "CurrentProfileCount":  925,
    "AddedProfileCount":  230,
    "RemovedProfileCount":  0,
    "SemanticChangedProfileCount":  38,
    "SemanticUnchangedProfileCount":  657,
    "RawByteDifferentProfileCount":  681,
    "FormattingOnlyChangedProfileCount":  643,
    "Added":  [
                  "1on1gov",
                  "aerofgts",
                  "aerofgtsg",
                  "animechmp",
                  "aplarail",
                  "aquarush",
                  "ballpom",
                  "bam2",
                  "beastrzr",
                  "bldyror2",
                  "brvblade",
                  "brvbladeg",
                  "btchamp",
                  "cbaj",
                  "chaoshea",
                  "chocovdr",
                  "cryptklr",
                  "danceyesu",
                  "darkhleg",
                  "ddr2m",
                  "ddr2mc2",
                  "ddr2ml",
                  "ddr3mk",
                  "ddr3mp",
                  "ddr4m",
                  "ddr4mp",
                  "ddr4mps",
                  "ddr4ms",
                  "ddr5m",
                  "ddrbocd",
                  "ddrextrm",
                  "ddrkara",
                  "ddrkara2",
                  "ddrmax",
                  "ddrmax2",
                  "ddrs2k",
                  "ddrsbm",
                  "ddrusa",
                  "dmx2m",
                  "dmx2majp",
                  "dncfrks",
                  "doapp",
                  "drmn",
                  "drmn2mpu",
                  "drmn7m",
                  "drmn9m",
                  "dsem",
                  "dsem2",
                  "dsfdct",
                  "dsfdr",
                  "dsftkd",
                  "dstage",
                  "dunkmnia",
                  "ehrgeiz",
                  "fambowl",
                  "fbait2bc",
                  "fbaitbc",
                  "fbaitmc",
                  "fgtlayer",
                  "flamegun",
                  "flamegung",
                  "flipmaze",
                  "ftimpactg",
                  "ftimpcta",
                  "g13jnr",
                  "g13knd",
                  "gahaha",
                  "gahaha2",
                  "gamshara",
                  "gbbchmp",
                  "gchgchmp",
                  "gdarius2",
                  "gdariusg",
                  "gegemdb",
                  "ghlpanic",
                  "gjspace",
                  "glpracr",
                  "glpracr2",
                  "glpracr3",
                  "gobyrc",
                  "golgo13",
                  "gtfrk10m",
                  "gtfrk11m",
                  "gtrfrk2m",
                  "gtrfrk2ml2",
                  "gtrfrk3m",
                  "gtrfrk4m",
                  "gtrfrk5m",
                  "gtrfrk6m",
                  "gtrfrk7m",
                  "gtrfrk8m",
                  "gtrfrk9m",
                  "gtrfrks",
                  "gunmania",
                  "hvnsgate",
                  "hypbbc2p",
                  "hyperath",
                  "hyperbbc",
                  "ippo",
                  "ippo2",
                  "jdredd",
                  "jgakuen",
                  "jppyex98",
                  "kaiunqz",
                  "kartduel",
                  "kd2001",
                  "kdeadeye",
                  "keroro",
                  "kicknkick",
                  "knpuzzle",
                  "kollonc",
                  "konam80s",
                  "konotako",
                  "lacrazyc",
                  "lbgrande",
                  "lpadv",
                  "mahjngoh",
                  "mamboagg",
                  "mawasunda",
                  "mdhorse",
                  "medalnt",
                  "medalnt2",
                  "mfjump",
                  "mgcldtex",
                  "mrdrillr",
                  "mrdrilr2",
                  "mrdrilrg",
                  "mrtlbeat",
                  "myangel3",
                  "nagano98",
                  "nbajamex",
                  "nflclsfb",
                  "nicetsuk",
                  "nightrai",
                  "otenamhf",
                  "otenamih",
                  "otenki",
                  "pacapp",
                  "pacapp2",
                  "pacappsp",
                  "pacmball",
                  "panikuru",
                  "pcnfrk10m",
                  "pcnfrk3m",
                  "pcnfrk4m",
                  "pcnfrk5m",
                  "pcnfrk6m",
                  "pcnfrk8m",
                  "plsmaswd",
                  "pnchmn",
                  "pnchmn2",
                  "pocketrc",
                  "powyak96",
                  "powyakex",
                  "primglex",
                  "primrag2",
                  "psyforce",
                  "psyforcex",
                  "psyvarij",
                  "psyvarrv",
                  "ptblank2",
                  "ptblank3",
                  "puzzball",
                  "raycris",
                  "raystorm",
                  "raystormg",
                  "rvschool",
                  "salarymc",
                  "sekaikh",
                  "sfchamp",
                  "sfex",
                  "sfex2p",
                  "sfex2u",
                  "sfexp",
                  "shanghss",
                  "shangtou",
                  "shikigam",
                  "shngmtkb",
                  "shngmtkbg",
                  "sianniv",
                  "simpbowl",
                  "slotouji",
                  "soulclbruc",
                  "souledge",
                  "soutenry",
                  "spuzbobl",
                  "squizchs",
                  "starglad",
                  "starswep",
                  "startrgn",
                  "stepchmp",
                  "strgchmp",
                  "strider2",
                  "sugorotc",
                  "susume",
                  "sws2000",
                  "sws2001",
                  "sws98",
                  "sws99",
                  "taiko2",
                  "taiko3",
                  "taiko4",
                  "taiko5",
                  "taiko6",
                  "taikort",
                  "tblkkuzu",
                  "tblkkuzug",
                  "technodr",
                  "techromn",
                  "tekken",
                  "tekken2",
                  "tekken3",
                  "tektagt",
                  "tenkomor",
                  "tgmj",
                  "tmosh",
                  "tmoshs",
                  "tmoshsp",
                  "tondemo",
                  "toukon3",
                  "truckk",
                  "ts2",
                  "twcupmil",
                  "ujlnow",
                  "usagi",
                  "weddingr",
                  "xevi3dg",
                  "xiistag",
                  "zokuoten",
                  "zooo"
              ],
    "Removed":  [

                ],
    "Changed":  [
                    "bbust2",
                    "calspeed",
                    "cartfury",
                    "code1d",
                    "crusnexo",
                    "crusnusa",
                    "crusnwld",
                    "daytona",
                    "gticlub",
                    "hyprdriv",
                    "indy500",
                    "invasnab",
                    "jpark3u",
                    "offroadc",
                    "overrevb",
                    "racingj",
                    "racingj2",
                    "racjamdx",
                    "roadedge",
                    "sf2049",
                    "sf2049se",
                    "sf2049te",
                    "sfrush",
                    "sfrushrk",
                    "sgt24h",
                    "srallyc",
                    "sscope",
                    "sscope2",
                    "stcc",
                    "terabrst",
                    "thrild2a",
                    "thrilld",
                    "thrilldgeu",
                    "vaportrx",
                    "vformula",
                    "vr",
                    "xrally",
                    "xtrial"
                ],
    "Unchanged":  [
                      "2Spicy",
                      "2SpicyElf2",
                      "3DCosplayMahjong",
                      "500gp",
                      "a51site4",
                      "AAA",
                      "abc",
                      "abcELF2",
                      "acedriv3",
                      "acedrive",
                      "ActionDeka",
                      "adillor",
                      "AfterDark",
                      "AfterDark2",
                      "ainferno",
                      "airco22b",
                      "aircomb",
                      "airwlkrs",
                      "akaievo",
                      "AkaiKatanaShinNesica",
                      "AKB48",
                      "aking",
                      "Akuma",
                      "Aleste",
                      "AliensArmageddon",
                      "AliensExtermination",
                      "AlpineRacer",
                      "alpinerd",
                      "alpines",
                      "alpinr2b",
                      "AngryBirds",
                      "aquajet",
                      "AquapazzaAquaplusDreamMatch",
                      "ArcadeLove",
                      "ArcanaHeart2Nesica",
                      "ArcanaHeart3Exboard",
                      "ArcanaHeart3Nesica",
                      "ArcticThunder",
                      "Ballistics",
                      "BaseballHeroes",
                      "batlgr3",
                      "batlgr3t",
                      "Batman",
                      "BattleClimax",